{
  "$schema": "http://json-schema.org/draft-07/schema#",
  "$id": "siteforgemagie/observations/v1",
  "title": "Observation de forgemagie en jeu",
  "description": "Une tentative réelle de pose de rune observée dans le client DOFUS. C'est la seule voie vers le statut MODÈLE EMPIRIQUE : un modèle probabiliste ne peut être calibré que sur des observations de ce format, avec N documenté. Un fichier d'observations est un tableau JSON de ces objets (validateur : src/logic/observations/validate.ts).",
  "type": "object",
  "additionalProperties": false,
  "required": [
    "schemaVersion",
    "gameVersion",
    "itemId",
    "itemLevel",
    "lineStateBefore",
    "runeId",
    "outcome",
    "lineStateAfter",
    "residualVisible",
    "source",
    "date"
  ],
  "properties": {
    "schemaVersion": { "const": 1 },
    "gameVersion": {
      "type": "string",
      "description": "Version du client au moment de l'observation, ex. \"3.6.10.11\" (affichée dans le client ; comparer avec data/dataset.json → meta.gameVersion).",
      "pattern": "^[0-9]+(\\.[0-9]+){1,3}$"
    },
    "itemId": { "type": "integer", "minimum": 1, "description": "Identifiant DofusDB de l'objet (data/items.json → id)." },
    "itemLevel": { "type": "integer", "minimum": 1, "maximum": 200 },
    "lineStateBefore": {
      "type": "array",
      "minItems": 1,
      "description": "Toutes les lignes visibles de l'objet AVANT la tentative, y compris malus et exos.",
      "items": { "$ref": "#/definitions/line" }
    },
    "lineStateBeforeDeduced": {
      "type": "boolean",
      "description": "Vrai si l'état AVANT n'a pas été lu directement mais déduit de l'état après et des modifications affichées (historique du client). Une observation déduite reste auditable mais pèse moins qu'une lecture."
    },
    "runeId": { "type": "integer", "minimum": 1, "description": "Identifiant DofusDB de la rune posée (data/dataset.json → runes[].id ou transcendenceRunes[].id)." },
    "outcome": { "type": "string", "enum": ["SC", "SN", "EC"], "description": "Issue affichée par le client." },
    "lineStateAfter": {
      "type": "array",
      "minItems": 1,
      "description": "Toutes les lignes visibles de l'objet APRÈS la tentative.",
      "items": { "$ref": "#/definitions/line" }
    },
    "residualVisible": {
      "type": "boolean",
      "description": "Le client affichait-il une valeur de reliquat ? (empirical_params → residualPool.visibleInClient est une CONTRADICTION : cette case sert à la trancher.)"
    },
    "residualBefore": { "type": ["number", "null"], "minimum": 0, "description": "Reliquat affiché avant, si visible ; null sinon." },
    "residualAfter": { "type": ["number", "null"], "minimum": 0, "description": "Reliquat affiché après, si visible ; null sinon." },
    "source": {
      "type": "string",
      "minLength": 1,
      "description": "Origine de l'observation : pseudo de l'observateur, lien vers la capture/vidéo, serveur de jeu. Sans source, l'observation ne peut pas être auditée."
    },
    "date": { "type": "string", "format": "date-time", "description": "Horodatage ISO 8601 de la tentative." },
    "server": { "type": "string", "description": "Serveur de jeu (facultatif)." },
    "notes": { "type": "string", "description": "Contexte libre : objet fraîchement crafté, passage par HDV, orbe utilisé avant, etc." }
  },
  "definitions": {
    "line": {
      "type": "object",
      "additionalProperties": false,
      "required": ["characteristicId", "value"],
      "properties": {
        "characteristicId": { "type": "integer", "minimum": 1, "description": "Champ `characteristic` DofusDB (data/dataset.json → characteristics)." },
        "value": { "type": "integer", "description": "Valeur affichée (négative pour un malus)." },
        "isExo": { "type": "boolean", "description": "Ligne absente du patron de l'objet." }
      }
    }
  }
}
